{
  "schema_version": 1,
  "plan": "docs/superpowers/plans/2026-07-03-analog-four-audio-patch-genome.md",
  "branch": "codex/a4-sysex-roundtrip-writer",
  "pull_request": 214,
  "phase": "review",
  "workstreams": {
    "audio_inference": "complete",
    "patch_genome": "complete",
    "saved_kit_writer": "complete",
    "batch_publication": "complete",
    "operator_cli": "complete",
    "saved_kit_hardware_validation": "complete",
    "full_live_plan_hardware_validation": "pending",
    "learning_capture": "complete",
    "final_gates": "in_progress"
  },
  "last_event": "The 2026-07-29 supervised 33-row rehearsal completed transport but disproved six enum ordinals; the operator reloaded without saving. Those rows now fail closed, older internally valid manifests are revalidated against current transport policy before provider construction, and the guarded plan is reduced to 27 rows / 37 messages. Fresh CI, reviewer approval, and a successful corrected-plan physical rehearsal remain pending."
}
